85.4,Mastectomy,ICD9CM_2010
85.41,Unilateral simple mastectomy,ICD9CM_2010
85.42,Bilateral simple mastectomy,ICD9CM_2010
85.43,Unilateral extended simple mastectomy,ICD9CM_2010
85.44,Bilateral extended simple mastectomy,ICD9CM_2010
85.45,Unilateral radical mastectomy,ICD9CM_2010
85.46,Bilateral radical mastectomy,ICD9CM_2010
85.47,Unilateral extended radical mastectomy,ICD9CM_2010
85.48,Bilateral extended radical mastectomy,ICD9CM_2010
85.5,Augmentation mammoplasty,ICD9CM_2010
85.50,"Augmentation mammoplasty, not otherwise specified",ICD9CM_2010
85.51,Unilateral injection into breast for augmentation,ICD9CM_2010
85.52,Bilateral injection into breast for augmentation,ICD9CM_2010
85.53,Unilateral breast implant,ICD9CM_2010
85.54,Bilateral breast implant,ICD9CM_2010
85.6,Mastopexy,ICD9CM_2010
85.7,Total reconstruction of breast,ICD9CM_2010
85.70,"Total reconstruction of breast, not otherwise specified",ICD9CM_2010
85.71,Latissimus dorsi myocutaneous flap,ICD9CM_2010
85.72,"Transverse rectus abdominis myocutaneous (TRAM) flap, pedicled",ICD9CM_2010
85.73,"Transverse rectus abdominis myocutaneous (TRAM) flap,free",ICD9CM_2010
85.74,Deep inferior epigastric artery perforatar (DIEP),ICD9CM_2010
85.75,"Superficial inferior epigastric artery (SIEA) flap, free",ICD9CM_2010
85.76,"Gluteal artery perforator (GAP) flap, free",ICD9CM_2010
85.79,Other total reconstruction of breast,ICD9CM_2010
85.8,Other repair and plastic operations on breast,ICD9CM_2010
85.81,Suture of laceration of breast,ICD9CM_2010
85.82,Split-thickness graft to breast,ICD9CM_2010
85.83,Full-thickness graft to breast,ICD9CM_2010
85.84,Pedicle graft to breast,ICD9CM_2010
85.85,Muscle flap graft to breast,ICD9CM_2010
85.86,Transposition of nipple,ICD9CM_2010
85.87,Other repair or reconstruction of nipple,ICD9CM_2010
85.89,Other mammoplasty,ICD9CM_2010
85.9,Other operations on the breast,ICD9CM_2010
85.91,Aspiration of breast,ICD9CM_2010
85.92,Injection of therapeutic agent into breast,ICD9CM_2010
85.93,Revision of implant of breast,ICD9CM_2010
85.94,Removal of implant of breast,ICD9CM_2010
85.95,Insertion of breast tissue expander,ICD9CM_2010
85.96,Removal of breast tissue expander (s),ICD9CM_2010
85.99,Other operations on the breast,ICD9CM_2010
86,Operations on skin and subcutaneous tissue,ICD9CM_2010
86.0,Incision of skin and subcutaneous tissue,ICD9CM_2010
86.01,Aspiration of skin and subcutaneous tissue,ICD9CM_2010
86.02,Injection or tattooing of skin lesion or defect,ICD9CM_2010
86.03,Incision of pilonidal sinus or cyst,ICD9CM_2010
86.04,Other incision with drainage of skin and subcutaneous tissue,ICD9CM_2010
86.05,Incision with removal of foreign body from skin and subcutaneous tissue,ICD9CM_2010
86.06,Insertion of totally implantable infusion pump,ICD9CM_2010
86.07,Insertion of totally implantable vascular access device (vad),ICD9CM_2010
86.09,Other incision of skin and subcutaneous tissue,ICD9CM_2010
86.1,Diagnostic procedures on skin and subcutaneous tissue,ICD9CM_2010
86.11,Biopsy of skin and subcutaneous tissue,ICD9CM_2010
86.19,Other diagnostic procedures on skin and subcutaneous tissue,ICD9CM_2010
86.2,Excision or destruction of lesion or tissue of skin and subcutaneous,ICD9CM_2010
86.21,Excision of pilonidal cyst or sinus,ICD9CM_2010
86.22,"Excisional debridement of wound, infection, or burn",ICD9CM_2010
86.23,"Removal of nail, nailbed, or nail fold",ICD9CM_2010
86.24,Chemosurgery of skin,ICD9CM_2010
86.25,Dermabrasion,ICD9CM_2010
86.26,Ligation of dermal appendage,ICD9CM_2010
86.27,"Debridement of nail, nail bed, or nail fold",ICD9CM_2010
86.28,"Nonexcisional debridement of wound, infection, or burn",ICD9CM_2010
86.3,Other local excision or destruction of lesion or tissue of skin and,ICD9CM_2010
86.4,Radical excision of skin lesion,ICD9CM_2010
86.5,Suture of skin and subcutaneous tissue,ICD9CM_2010
86.51,Replantation of scalp,ICD9CM_2010
86.59,Suture of skin and subcutaneous tissue of other sites,ICD9CM_2010
86.6,Free skin graft,ICD9CM_2010
86.60,"Free skin graft, not otherwise specified",ICD9CM_2010
86.61,Full-thickness skin graft to hand,ICD9CM_2010
86.62,Other skin graft to hand,ICD9CM_2010
86.63,Full-thickness skin graft to other sites,ICD9CM_2010
86.64,Hair transplant,ICD9CM_2010
86.65,Heterograft to skin,ICD9CM_2010
86.66,Homograft to skin,ICD9CM_2010
86.67,Dermal regenerative graft,ICD9CM_2010
86.69,Other skin graft to other sites,ICD9CM_2010
86.7,Pedicle grafts or flaps,ICD9CM_2010
86.70,"Pedicle or flap graft, not otherwise specified",ICD9CM_2010
86.71,Cutting and preparation of pedicle grafts or flaps,ICD9CM_2010
86.72,Advancement of pedicle graft,ICD9CM_2010
86.73,Attachment of pedicle or flap graft to hand,ICD9CM_2010
86.74,Attachment of pedicle or flap graft to other sites,ICD9CM_2010
86.75,Revision of pedicle or flap graft,ICD9CM_2010
86.8,Other repair and reconstruction of skin and subcutaneous tissue,ICD9CM_2010
86.81,Repair for facial weakness,ICD9CM_2010
86.82,Facial rhytidectomy,ICD9CM_2010
86.83,Size reduction plastic operation,ICD9CM_2010
86.84,Relaxation of scar or web contracture of skin,ICD9CM_2010
86.85,Correction of syndactyly,ICD9CM_2010
86.86,Onychoplasty,ICD9CM_2010
86.89,Other repair and reconstruction of skin and subcutaneous tissue,ICD9CM_2010
86.9,Other operations on skin and subcutaneous tissue,ICD9CM_2010
86.91,Excision of skin for graft,ICD9CM_2010
86.92,Electrolysis and other epilation of skin,ICD9CM_2010
86.93,Insertion of tissue expander,ICD9CM_2010
86.94,"Insertion or replacement of singer array neurostimulator pulse generator, not specified as rechargeable",ICD9CM_2010
86.95,"Insertion or replacement of dual array neurostimulator pulse generator, not specified as rechargeable",ICD9CM_2010
86.96,Insertion or replacement of other neurostimulator pulse generator,ICD9CM_2010
86.97,Insertion or replacement of singer array rechargeable neurostimulator pulse generator,ICD9CM_2010
86.98,Insertion or replacement of dual array rechargeable neurostimulator pulse generator,ICD9CM_2010
86.99,Other operations on skin and subcutaneous tissue,ICD9CM_2010
87,Diagnostic radiology,ICD9CM_2010
87.0,"Soft tissue x-ray of face, head, and neck",ICD9CM_2010
87.01,Pneumoencephalogram,ICD9CM_2010
87.02,Other contrast radiogram of brain and skull,ICD9CM_2010
87.03,Computerized axial tomography of head,ICD9CM_2010
87.04,Other tomography of head,ICD9CM_2010
87.05,Contrast dacryocystogram,ICD9CM_2010
87.06,Contrast radiogram of nasopharynx,ICD9CM_2010
87.07,Contrast laryngogram,ICD9CM_2010
87.08,Cervical lymphangiogram,ICD9CM_2010
87.09,"Other soft tissue x-ray of face, head, and neck",ICD9CM_2010
87.1,"Other x-ray of face, head, and neck",ICD9CM_2010
87.11,Full-mouth x-ray of teeth,ICD9CM_2010
87.12,Other dental x-ray,ICD9CM_2010
87.13,Temporomandibular contrast arthrogram,ICD9CM_2010
87.14,Contrast radiogram of orbit,ICD9CM_2010
87.15,Contrast radiogram of sinus,ICD9CM_2010
87.16,Other x-ray of facial bones,ICD9CM_2010
87.17,Other x-ray of skull,ICD9CM_2010
87.2,X-ray of spine,ICD9CM_2010
87.21,Contrast myelogram,ICD9CM_2010
87.22,Other x-ray of cervical spine,ICD9CM_2010
87.23,Other x-ray of thoracic spine,ICD9CM_2010
87.24,Other x-ray of lumbosacral spine,ICD9CM_2010
87.29,Other x-ray of spine,ICD9CM_2010
87.3,Soft tissue x-ray of thorax,ICD9CM_2010
87.31,Endotracheal bronchogram,ICD9CM_2010
87.32,Other contrast bronchogram,ICD9CM_2010
87.33,Mediastinal pneumogram,ICD9CM_2010
87.34,Intrathoracic lymphangiogram,ICD9CM_2010
87.35,Contrast radiogram of mammary ducts,ICD9CM_2010
87.36,Xerography of breast,ICD9CM_2010
87.37,Other mammography,ICD9CM_2010
87.38,Sinogram of chest wall,ICD9CM_2010
87.39,Other soft tissue x-ray of chest wall,ICD9CM_2010
87.4,Other x-ray of thorax,ICD9CM_2010
87.41,Computerized axial tomography of thorax,ICD9CM_2010
87.42,Other tomography of thorax,ICD9CM_2010
87.43,"X-ray of ribs, sternum, and clavicle",ICD9CM_2010
87.44,"Routine chest x-ray, so described",ICD9CM_2010
87.49,Other chest x-ray,ICD9CM_2010
87.5,Biliary tract x-ray,ICD9CM_2010
87.51,Percutaneous hepatic cholangiogram,ICD9CM_2010
87.52,Intravenous cholangiogram,ICD9CM_2010
87.53,Intraoperative cholangiogram,ICD9CM_2010
87.54,Other cholangiogram,ICD9CM_2010
87.59,Other biliary tract x-ray,ICD9CM_2010
87.6,Other x-ray of digestive system,ICD9CM_2010
87.61,Barium swallow,ICD9CM_2010
87.62,Upper gi series,ICD9CM_2010
87.63,Small bowel series,ICD9CM_2010
87.64,Lower gi series,ICD9CM_2010
87.65,Other x-ray of intestine,ICD9CM_2010
87.66,Contrast pancreatogram,ICD9CM_2010
87.69,Other digestive tract x-ray,ICD9CM_2010
87.7,X-ray of urinary system,ICD9CM_2010
87.71,Computerized axial tomography of kidney,ICD9CM_2010
87.72,Other nephrotomogram,ICD9CM_2010
87.73,Intravenous pyelogram,ICD9CM_2010
87.74,Retrograde pyelogram,ICD9CM_2010
87.75,Percutaneous pyelogram,ICD9CM_2010
87.76,Retrograde cystourethrogram,ICD9CM_2010
87.77,Other cystogram,ICD9CM_2010
87.78,Ileal conduitogram,ICD9CM_2010
87.79,Other x-ray of the urinary system,ICD9CM_2010
87.8,X-ray of female genital organs,ICD9CM_2010
87.81,X-ray of gravid uterus,ICD9CM_2010
87.82,Gas contrast hysterosalpingogram,ICD9CM_2010
87.83,Opaque dye contrast hysterosalpingogram,ICD9CM_2010
87.84,Percutaneous hysterogram,ICD9CM_2010
87.85,Other x-ray of fallopian tubes and uterus,ICD9CM_2010
87.89,Other x-ray of female genital organs,ICD9CM_2010
87.9,X-ray of male genital organs,ICD9CM_2010
87.91,Contrast seminal vesiculogram,ICD9CM_2010
87.92,Other x-ray of prostate and seminal vesicles,ICD9CM_2010
87.93,Contrast epididymogram,ICD9CM_2010
87.94,Contrast vasogram,ICD9CM_2010
87.95,Other x-ray of epididymis and vas deferens,ICD9CM_2010
87.99,Other x-ray of male genital organs,ICD9CM_2010
88,Other diagnostic radiology and related techniques,ICD9CM_2010
88.0,Soft tissue x-ray of abdomen,ICD9CM_2010
88.01,Computerized axial tomography of abdomen,ICD9CM_2010
88.02,Other abdomen tomography,ICD9CM_2010
88.03,Sinogram of abdominal wall,ICD9CM_2010
88.04,Abdominal lymphangiogram,ICD9CM_2010
88.09,Other soft tissue x-ray of abdominal wall,ICD9CM_2010
88.1,Other x-ray of abdomen,ICD9CM_2010
88.11,Pelvic opaque dye contrast radiography,ICD9CM_2010
88.12,Pelvic gas contrast radiography,ICD9CM_2010
88.13,Other peritoneal pneumogram,ICD9CM_2010
88.14,Retroperitoneal fistulogram,ICD9CM_2010
88.15,Retroperitoneal pneumogram,ICD9CM_2010
88.16,Other retroperitoneal x-ray,ICD9CM_2010
88.19,Other x-ray of abdomen,ICD9CM_2010
88.2,Skeletal x-ray of extremities and pelvis,ICD9CM_2010
88.21,Skeletal x-ray of shoulder and upper arm,ICD9CM_2010
88.22,Skeletal x-ray of elbow and forearm,ICD9CM_2010
88.23,Skeletal x-ray of wrist and hand,ICD9CM_2010
88.24,"Skeletal x-ray of upper limb, not otherwise specified",ICD9CM_2010
88.25,Pelvimetry,ICD9CM_2010
88.26,Other skeletal x-ray of pelvis and hip,ICD9CM_2010
88.27,"Skeletal x-ray of thigh, knee, and lower leg",ICD9CM_2010
88.28,Skeletal x-ray of ankle and foot,ICD9CM_2010
88.29,"Skeletal x-ray of lower limb, not otherwise specified",ICD9CM_2010
88.3,Other x-ray,ICD9CM_2010
88.31,Skeletal series,ICD9CM_2010
88.32,Contrast arthrogram,ICD9CM_2010
88.33,Other skeletal x-ray,ICD9CM_2010
88.34,Lymphangiogram of upper limb,ICD9CM_2010
88.35,Other soft tissue x-ray of upper limb,ICD9CM_2010
88.36,Lymphangiogram of lower limb,ICD9CM_2010
88.37,Other soft tissue x-ray of lower limb,ICD9CM_2010
88.38,Other computerized axial tomography,ICD9CM_2010
88.39,"X-ray, other and unspecified",ICD9CM_2010
88.4,Arteriography using contrast material,ICD9CM_2010
88.40,"Arteriography using contrast material, unspecified site",ICD9CM_2010
88.41,Arteriography of cerebral arteries,ICD9CM_2010
88.42,Aortography,ICD9CM_2010
88.43,Arteriography of pulmonary arteries,ICD9CM_2010
88.44,Arteriography of other intrathoracic vessels,ICD9CM_2010
88.45,Arteriography of renal arteries,ICD9CM_2010
88.46,Arteriography of placenta,ICD9CM_2010
88.47,Arteriography of other intra-abdominal arteries,ICD9CM_2010
88.48,Arteriography of femoral and other lower extremity arteries,ICD9CM_2010
88.49,Arteriography of other specified sites,ICD9CM_2010
88.5,Angiocardiography using contrast material,ICD9CM_2010
88.50,"Angiocardiography, not otherwise specified",ICD9CM_2010
88.51,Angiocardiography of venae cavae,ICD9CM_2010
88.52,Angiocardiography of right heart structures,ICD9CM_2010
88.53,Angiocardiography of left heart structures,ICD9CM_2010
88.54,Combined right and left heart angiocardiography,ICD9CM_2010
88.55,Coronary arteriography using a single catheter,ICD9CM_2010
88.56,Coronary arteriography using two catheters,ICD9CM_2010
88.57,Other and unspecified coronary arteriography,ICD9CM_2010
88.58,Negative-contrast cardiac roentgenography,ICD9CM_2010
88.59,Intra-operative fluorescence vascular angiography,ICD9CM_2010
88.6,Phlebography,ICD9CM_2010
88.60,"Phlebography using contrast material, unspecified site",ICD9CM_2010
88.61,Phlebography of veins of head and neck using contrast material,ICD9CM_2010
88.62,Phlebography of pulmonary veins using contrast material,ICD9CM_2010
88.63,Phlebography of other intrathoracic veins using contrast material,ICD9CM_2010
88.64,Phlebography of the portal venous system using contrast material,ICD9CM_2010
88.65,Phlebography of other intra-abdominal veins using contrast material,ICD9CM_2010
88.66,Phlebography of femoral and other lower extremity veins using contra,ICD9CM_2010
88.67,Phlebography of other specified sites using contrast material,ICD9CM_2010
88.68,Impedance phlebography,ICD9CM_2010
88.7,Diagnostic ultrasound,ICD9CM_2010
88.71,Diagnostic ultrasound of head and neck,ICD9CM_2010
88.72,Diagnostic ultrasound of heart,ICD9CM_2010
88.73,Diagnostic ultrasound of other sites of thorax,ICD9CM_2010
88.74,Diagnostic ultrasound of digestive system,ICD9CM_2010
88.75,Diagnostic ultrasound of urinary system,ICD9CM_2010
88.76,Diagnostic ultrasound of abdomen and retroperitoneum,ICD9CM_2010
88.77,Diagnostic ultrasound of peripheral vascular system,ICD9CM_2010
88.78,Diagnostic ultrasound of gravid uterus,ICD9CM_2010
88.79,Other diagnostic ultrasound,ICD9CM_2010
88.8,Thermography,ICD9CM_2010
88.81,Cerebral thermography,ICD9CM_2010
88.82,Ocular thermography,ICD9CM_2010
88.83,Bone thermography,ICD9CM_2010
88.84,Muscle thermography,ICD9CM_2010
88.85,Breast thermography,ICD9CM_2010
88.86,Blood vessel thermography,ICD9CM_2010
88.89,Thermography of other sites,ICD9CM_2010
88.9,Other diagnostic imaging,ICD9CM_2010
88.90,"Diagnostic imaging, not elsewhere classified",ICD9CM_2010
88.91,Magnetic resonance imaging of brain and brain stem,ICD9CM_2010
88.92,Magnetic resonance imaging of chest and myocardium for evaluation of,ICD9CM_2010
88.93,Magnetic resonance imaging of spinal canal,ICD9CM_2010
88.94,Magnetic resonance imaging of musculoskeletal,ICD9CM_2010
88.95,"Magnetic resonance imaging of pelvis, prostate, and bladder",ICD9CM_2010
88.96,Other intraoperative magnetic resonance imaging,ICD9CM_2010
88.97,Magnetic resonance imaging of other and unspecified sites,ICD9CM_2010
88.98,Bone mineral density studies,ICD9CM_2010
89,"Interview, evaluation, consultation, and examination",ICD9CM_2010
89.0,"Diagnostic interview, consultation, and evaluation",ICD9CM_2010
89.01,"Interview and evaluation, described as brief",ICD9CM_2010
89.02,"Interview and evaluation, described as limited",ICD9CM_2010
89.03,"Interview and evaluation, described as comprehensive",ICD9CM_2010
89.04,Other interview and evaluation,ICD9CM_2010
89.05,"Diagnostic interview and evaluation, not otherwise specified",ICD9CM_2010
89.06,"Consultation, described as limited",ICD9CM_2010
89.07,"Consultation, described as comprehensive",ICD9CM_2010
89.08,Other consultation,ICD9CM_2010
89.09,"Consultation, not otherwise specified",ICD9CM_2010
89.1,Anatomic and physiologic measurements and manual examinations - nervous system and sense organs,ICD9CM_2010
89.10,Intracarotid amobarbitral test,ICD9CM_2010
89.11,Tonometry,ICD9CM_2010
89.12,Nasal function study,ICD9CM_2010
89.13,Neurologic examination,ICD9CM_2010
89.14,Electroencephalogram,ICD9CM_2010
89.15,Other nonoperative neurologic function tests,ICD9CM_2010
89.16,Transillumination of newborn skull,ICD9CM_2010
89.17,Polysomnogram,ICD9CM_2010
89.18,Other sleep disorder function tests,ICD9CM_2010
89.19,Video and radio-telemetered electroencephalographic monitoring,ICD9CM_2010
89.2,Anatomic and physiologic measurements and manual examinations - genitourinary system,ICD9CM_2010
89.21,Urinary manometry,ICD9CM_2010
89.22,Cystometrogram,ICD9CM_2010
89.23,Urethral sphincter electromyogram,ICD9CM_2010
89.24,Uroflowmetry (UFR),ICD9CM_2010
89.25,Urethral pressure profile (UPP),ICD9CM_2010
89.26,Gynecological examination,ICD9CM_2010
89.29,Other nonoperative genitourinary system measurements,ICD9CM_2010
89.3,Other anatomic and physiologic measurements and manual examinations,ICD9CM_2010
89.31,Dental examination,ICD9CM_2010
89.32,Esophageal manometry,ICD9CM_2010
89.33,Digital examination of enterostomy stoma,ICD9CM_2010
89.34,Digital examination of rectum,ICD9CM_2010
89.35,Transillumination of nasal sinuses,ICD9CM_2010
89.36,Manual examination of breast,ICD9CM_2010
89.37,Vital capacity determination,ICD9CM_2010
89.38,Other nonoperative respiratory measurements,ICD9CM_2010
89.39,Other nonoperative measurements and examinations,ICD9CM_2010
89.4,"Cardiac stress tests, pacemaker and defibrillator checks",ICD9CM_2010
89.41,Cardiovascular stress test using treadmill,ICD9CM_2010
89.42,Masters' two-step stress test,ICD9CM_2010
89.43,Cardiovascular stress test using bicycle ergometer,ICD9CM_2010
89.44,Other cardiovascular stress test,ICD9CM_2010
89.45,Artificial pacemaker rate check,ICD9CM_2010
89.46,Artificial pacemaker artifact wave form check,ICD9CM_2010
89.47,Artificial pacemaker electrode impedance check,ICD9CM_2010
89.48,Artificial pacemaker voltage or amperage threshold check,ICD9CM_2010
89.49,Automatic implantable cardioverter / defibrillator (AICD) check,ICD9CM_2010
89.5,Other nonoperative cardiac and vascular diagnostic procedures,ICD9CM_2010
89.50,Ambulatory cardiac monitoring,ICD9CM_2010
89.51,Rhythm electrocardiogram,ICD9CM_2010
89.52,Electrocardiogram,ICD9CM_2010
89.53,Vectorcardiogram (with ecg),ICD9CM_2010
89.54,Electrographic monitoring,ICD9CM_2010
89.55,Phonocardiogram with ECG lead,ICD9CM_2010
89.56,Carotid pulse tracing with ECG lead,ICD9CM_2010
89.57,Apexcardiogram (with ECG lead),ICD9CM_2010
89.58,Plethysmogram,ICD9CM_2010
89.59,Other nonoperative cardiac and vascular measurements,ICD9CM_2010
89.6,Circulatory monitoring,ICD9CM_2010
89.60,Continuous intra-arterial blood gas monitoring,ICD9CM_2010
89.61,Systemic arterial pressure monitoring,ICD9CM_2010
89.62,Central venous pressure monitoring,ICD9CM_2010
89.63,Pulmonary artery pressure monitoring,ICD9CM_2010
89.64,Pulmonary artery wedge monitoring,ICD9CM_2010
89.65,Measurement of systemic arterial blood gases,ICD9CM_2010
89.66,Measurement of mixed venous blood gases,ICD9CM_2010
89.67,Monitoring of cardiac output by oxygen consumption technique,ICD9CM_2010
89.68,Monitoring of cardiac output by other technique,ICD9CM_2010
89.69,Monitoring of coronary blood flow,ICD9CM_2010
89.7,General physical examination,ICD9CM_2010
89.8,Autopsy,ICD9CM_2010
90,Microscopic examination - I,ICD9CM_2010
90.0,Microscopic examination of specimen from nervous system and of spina fluid,ICD9CM_2010
90.01,"Microscopic examination of specimen from nervous system and of spina fluid,Bacterial smear",ICD9CM_2010
90.02,"Microscopic examination of specimen from nervous system and of spina fluid, Culture",ICD9CM_2010
90.03,"Microscopic examination of specimen from nervous system and of spina fluid, Culture and sensitivity",ICD9CM_2010
90.04,"Microscopic examination of specimen from nervous system and of spina fluid, Parasitology",ICD9CM_2010
90.05,"Microscopic examination of specimen from nervous system and of spina fluid, Toxicology",ICD9CM_2010
90.06,"Microscopic examination of specimen from nervous system and of spina fluid, Cell block and papanicolaou smear",ICD9CM_2010
90.09,"Microscopic examination of specimen from nervous system and of spina fluid, Other microscopic examination",ICD9CM_2010
90.1,"Microscopic examination of specimen from endocrine gland, not elsewhere classified",ICD9CM_2010
90.11,"Microscopic examination of specimen from endocrine gland, not elsewhere classified, Bacterial smear",ICD9CM_2010
90.12,"Microscopic examination of specimen from endocrine gland, not elsewhere classified, Culture",ICD9CM_2010
90.13,"Microscopic examination of specimen from endocrine gland, not elsewhere classified, Culture and sensitivity",ICD9CM_2010
90.14,"Microscopic examination of specimen from endocrine gland, not elsewhere classified, Parasitology",ICD9CM_2010
90.15,"Microscopic examination of specimen from endocrine gland, not elsewhere classified, Toxicology",ICD9CM_2010
90.16,"Microscopic examination of specimen from endocrine gland, not elsewhere classified, Cell block and papanicolaou smear",ICD9CM_2010
90.19,"Microscopic examination of specimen from endocrine gland, not elsewhere classified, Other microscopic examination",ICD9CM_2010
90.2,Microscopic examination of specimen from eye,ICD9CM_2010
90.21,"Microscopic examination of specimen from eye, Bacterial smear",ICD9CM_2010
90.22,"Microscopic examination of specimen from eye, Culture",ICD9CM_2010
90.23,"Microscopic examination of specimen from eye, Culture and sensitivity",ICD9CM_2010
90.24,"Microscopic examination of specimen from eye, Parasitology",ICD9CM_2010
90.25,"Microscopic examination of specimen from eye, Toxicology",ICD9CM_2010
90.26,"Microscopic examination of specimen from eye, Cell block and papanicolaou smear",ICD9CM_2010
90.29,"Microscopic examination of specimen from eye, Other microscopic examination",ICD9CM_2010
90.3,"Microscopic examination of specimen from ear, nose, throat, and larynx",ICD9CM_2010
90.31,"Microscopic examination of specimen from ear, nose, throat, and larynx, Bacterial smear",ICD9CM_2010
90.32,"Microscopic examination of specimen from ear, nose, throat, and larynx, Culture",ICD9CM_2010
90.33,"Microscopic examination of specimen from ear, nose, throat, and larynx, Culture and sensitivity",ICD9CM_2010
90.34,"Microscopic examination of specimen from ear, nose, throat, and larynx, Parasitology",ICD9CM_2010
90.35,"Microscopic examination of specimen from ear, nose, throat, and larynx, Toxicology",ICD9CM_2010
90.36,"Microscopic examination of specimen from ear, nose, throat, and larynx, Cell block and papanicolaou smear",ICD9CM_2010
90.39,"Microscopic examination of specimen from ear, nose, throat, and larynx, Other microscopic examination",ICD9CM_2010
90.4,"Microscopic examination of specimen from trachea, bronchus, pleura,lung,and other thoracic specimen, and of sputum",ICD9CM_2010
90.41,"Microscopic examination of specimen from trachea, bronchus, pleura,lung,and other thoracic specimen, and of sputum, Bacterial smear",ICD9CM_2010
90.42,"Microscopic examination of specimen from trachea, bronchus, pleura,lung,and other thoracic specimen, and of sputum, Culture",ICD9CM_2010
90.43,"Microscopic examination of specimen from trachea, bronchus, pleura,lung,and other thoracic specimen, and of sputum, Culture and sensitivity",ICD9CM_2010
90.44,"Microscopic examination of specimen from trachea, bronchus, pleura,lung,and other thoracic specimen, and of sputum, Parasitology",ICD9CM_2010
90.45,"Microscopic examination of specimen from trachea, bronchus, pleura,lung,and other thoracic specimen, and of sputum, Toxicology",ICD9CM_2010
90.46,"Microscopic examination of specimen from trachea, bronchus, pleura,lung,and other thoracic specimen, and of sputum, Cell block and papanicolaou smear",ICD9CM_2010
90.49,"Microscopic examination of specimen from trachea, bronchus, pleura,lung,and other thoracic specimen, and of sputum, Other microscopic examination",ICD9CM_2010
90.5,Microscopic examination of blood,ICD9CM_2010
90.51,"Microscopic examination of blood, Bacterial smear",ICD9CM_2010
90.52,"Microscopic examination of blood, Culture",ICD9CM_2010
90.53,"Microscopic examination of blood, Culture and sensitivity",ICD9CM_2010
90.54,"Microscopic examination of blood, Parasitology",ICD9CM_2010
90.55,"Microscopic examination of blood,Toxicology",ICD9CM_2010
90.56,"Microscopic examination of blood, Cell block and papanicolaou smear",ICD9CM_2010
90.59,"Microscopic examination of blood, Other microscopic examination",ICD9CM_2010
90.6,Microscopic examination of specimen from spleen and of bone marrow,ICD9CM_2010
90.61,"Microscopic examination of specimen from spleen and of bone marrow, Bacterial smear",ICD9CM_2010
90.62,"Microscopic examination of specimen from spleen and of bone marrow, Culture",ICD9CM_2010
90.63,"Microscopic examination of specimen from spleen and of bone marrow, Culture and sensitivity",ICD9CM_2010
90.64,"Microscopic examination of specimen from spleen and of bone marrow, Parasitology",ICD9CM_2010
90.65,"Microscopic examination of specimen from spleen and of bone marrow, Toxicology",ICD9CM_2010
90.66,"Microscopic examination of specimen from spleen and of bone marrow, Cell block and papanicolaou smear",ICD9CM_2010
90.69,"Microscopic examination of specimen from spleen and of bone marrow, Other microscopic examination",ICD9CM_2010
90.7,Microscopic examination of specimen from lymph node and of lymph,ICD9CM_2010
90.71,"Microscopic examination of specimen from lymph node and of lymph, Bacterial smear",ICD9CM_2010
90.72,"Microscopic examination of specimen from lymph node and of lymph, Culture",ICD9CM_2010
90.73,"Microscopic examination of specimen from lymph node and of lymph, Culture and sensitivity",ICD9CM_2010
90.74,"Microscopic examination of specimen from lymph node and of lymph, Parasitology",ICD9CM_2010
90.75,"Microscopic examination of specimen from lymph node and of lymph, Toxicology",ICD9CM_2010
90.76,"Microscopic examination of specimen from lymph node and of lymph, Cell block and papanicolaou smear",ICD9CM_2010
